{
  "$schema": "https://json-schema.org/draft/2020-12/schema",
  "$id": "https://askrigor.com/schemas/benchmark-defect-ledger-v1.json",
  "title": "AskRigor Benchmark Defect Ledger",
  "description": "Decision-as-data ledger adapted from SciCode-Verified. Corrections create new evaluator epochs and never overwrite official results.",
  "type": "object",
  "additionalProperties": false,
  "required": [
    "schemaVersion",
    "benchmarkId",
    "evaluatorVersion",
    "manifestIdentity",
    "entries"
  ],
  "properties": {
    "schemaVersion": {
      "const": 1
    },
    "benchmarkId": {
      "type": "string",
      "minLength": 1
    },
    "evaluatorVersion": {
      "type": "string",
      "minLength": 1
    },
    "manifestIdentity": {
      "type": "string",
      "pattern": "^[0-9a-f]{64}$"
    },
    "entries": {
      "type": "array",
      "items": {
        "$ref": "#/$defs/entry"
      }
    }
  },
  "$defs": {
    "entry": {
      "type": "object",
      "additionalProperties": false,
      "required": [
        "id",
        "discoveredAt",
        "itemOrPath",
        "field",
        "class",
        "before",
        "proposedAfter",
        "verdict",
        "reason",
        "evidence",
        "impact",
        "severity",
        "status",
        "discoverer",
        "independentRecheckRequired"
      ],
      "properties": {
        "id": {
          "type": "string",
          "minLength": 1
        },
        "discoveredAt": {
          "type": "string",
          "format": "date-time"
        },
        "itemOrPath": {
          "type": "string",
          "minLength": 1
        },
        "field": {
          "type": "string",
          "minLength": 1
        },
        "class": {
          "enum": [
            "SPECIFICATION_CONTRADICTION",
            "MISSING_CONVENTION",
            "NON_UNIQUE_VALID_ANSWER",
            "REFERENCE_TARGET_ERROR",
            "TOLERANCE_TOO_STRICT",
            "TOLERANCE_TOO_PERMISSIVE",
            "JUDGE_NONDETERMINISM_OR_DRIFT",
            "PARSER_OR_FORMAT_REJECTION",
            "DEPENDENCY_OR_ENVIRONMENT_DRIFT",
            "DATA_PROVENANCE_OR_VERSION_MISMATCH",
            "STUDY_REPORT_IDENTITY_ERROR",
            "PARTICIPANT_DEPENDENCE_ERROR",
            "EXPOSURE_OR_ESTIMAND_INCOMPATIBILITY",
            "COMPARATOR_OR_OUTCOME_WINDOW_MISMATCH",
            "BENCHMARK_TARGET_CONFLICT",
            "OTHER_EVIDENCED"
          ]
        },
        "benchmarkTargetIntegrity": {
          "$ref": "#/$defs/benchmarkTargetIntegrity"
        },
        "before": {
          "$ref": "#/$defs/state"
        },
        "proposedAfter": {
          "$ref": "#/$defs/state"
        },
        "verdict": {
          "type": "string",
          "minLength": 1
        },
        "reason": {
          "type": "string",
          "minLength": 1
        },
        "evidence": {
          "type": "array",
          "minItems": 1,
          "items": {
            "type": "object",
            "additionalProperties": false,
            "required": ["kind", "value"],
            "properties": {
              "kind": {
                "enum": [
                  "REPRODUCTION",
                  "COUNTEREXAMPLE",
                  "INDEPENDENT_CALCULATION",
                  "SOURCE_CITATION",
                  "REPEATED_JUDGE_RUN",
                  "PROVENANCE_CHECK",
                  "DOMAIN_REVIEW"
                ]
              },
              "value": {
                "type": "string",
                "minLength": 1
              },
              "artifactHash": {
                "type": ["string", "null"]
              }
            }
          }
        },
        "impact": {
          "type": "object",
          "additionalProperties": false,
          "required": ["affectedItems", "scoreMayChange", "programConclusionMayChange"],
          "properties": {
            "affectedItems": {
              "type": "array",
              "items": {
                "type": "string",
                "minLength": 1
              },
              "uniqueItems": true
            },
            "affectedEpochs": {
              "type": "array",
              "items": {
                "type": "string",
                "minLength": 1
              },
              "uniqueItems": true
            },
            "scoreMayChange": {
              "type": "boolean"
            },
            "programConclusionMayChange": {
              "type": "boolean"
            },
            "boundedStatement": {
              "type": ["string", "null"]
            }
          }
        },
        "severity": {
          "enum": ["BLOCKER", "MAJOR", "MINOR", "NOT_ESTABLISHED"]
        },
        "status": {
          "enum": ["SUSPECTED", "CONFIRMED", "REFUTED", "UNRESOLVED", "CORRECTED"]
        },
        "discoverer": {
          "type": "string",
          "minLength": 1
        },
        "independentRecheckRequired": {
          "type": "boolean"
        },
        "recheck": {
          "type": "object",
          "additionalProperties": false,
          "required": ["reviewer", "reviewedAt", "decision", "reason"],
          "properties": {
            "reviewer": {
              "type": "string",
              "minLength": 1
            },
            "reviewedAt": {
              "type": "string",
              "format": "date-time"
            },
            "decision": {
              "enum": ["CONFIRM", "REFUTE", "UNRESOLVED"]
            },
            "reason": {
              "type": "string",
              "minLength": 1
            },
            "evidenceArtifactHash": {
              "type": ["string", "null"]
            }
          }
        },
        "correction": {
          "type": "object",
          "additionalProperties": false,
          "required": ["version", "releasedAt", "artifactHashes"],
          "properties": {
            "version": {
              "type": "string",
              "minLength": 1
            },
            "releasedAt": {
              "type": "string",
              "format": "date-time"
            },
            "artifactHashes": {
              "type": "array",
              "minItems": 1,
              "items": {
                "type": "string",
                "minLength": 1
              },
              "uniqueItems": true
            }
          }
        }
      },
      "allOf": [
        {
          "if": {
            "properties": {
              "class": {
                "const": "BENCHMARK_TARGET_CONFLICT"
              }
            },
            "required": ["class"]
          },
          "then": {
            "properties": {
              "benchmarkTargetIntegrity": {
                "type": "object",
                "properties": {
                  "clinicalValidity": {
                    "enum": ["MATERIALLY_INCONSISTENT", "CONTESTABLE"]
                  }
                },
                "required": ["clinicalValidity"]
              }
            },
            "required": ["benchmarkTargetIntegrity"]
          }
        },
        {
          "if": {
            "properties": {
              "independentRecheckRequired": {
                "const": true
              },
              "status": {
                "enum": ["CONFIRMED", "REFUTED", "UNRESOLVED", "CORRECTED"]
              }
            },
            "required": ["independentRecheckRequired", "status"]
          },
          "then": {
            "properties": {
              "recheck": {}
            },
            "required": ["recheck"]
          }
        },
        {
          "if": {
            "properties": {
              "status": {
                "const": "CORRECTED"
              }
            },
            "required": ["status"]
          },
          "then": {
            "properties": {
              "correction": {}
            },
            "required": ["correction"]
          },
          "else": {
            "not": {
              "required": ["correction"]
            }
          }
        }
      ]
    },
    "state": {
      "type": "object",
      "additionalProperties": false,
      "required": ["representation", "value"],
      "properties": {
        "representation": {
          "enum": ["TEXT", "JSON", "HASH", "NUMERIC", "ABSENT"]
        },
        "value": {
          "oneOf": [
            { "type": "string" },
            { "type": "number" },
            { "type": "object" },
            { "type": "array" },
            { "type": "null" }
          ]
        },
        "sha256": {
          "type": ["string", "null"]
        }
      }
    },
    "benchmarkTargetIntegrity": {
      "type": "object",
      "additionalProperties": false,
      "required": [
        "exactPopulation",
        "timing",
        "decisionContext",
        "highAuthorityEvidence",
        "evidenceCurrentnessChecked",
        "benchmarkConformity",
        "clinicalValidity",
        "protocolChangeBasis",
        "frozenOfficialResultDisposition"
      ],
      "properties": {
        "exactPopulation": {
          "type": "string",
          "minLength": 1,
          "pattern": "\\S"
        },
        "timing": {
          "type": "string",
          "minLength": 1,
          "pattern": "\\S"
        },
        "decisionContext": {
          "type": "string",
          "minLength": 1,
          "pattern": "\\S"
        },
        "highAuthorityEvidence": {
          "type": "array",
          "minItems": 1,
          "items": {
            "type": "string",
            "minLength": 1,
            "pattern": "\\S"
          },
          "uniqueItems": true
        },
        "evidenceCurrentnessChecked": {
          "const": true
        },
        "benchmarkConformity": {
          "enum": ["CONFORMS", "DOES_NOT_CONFORM", "MIXED"]
        },
        "clinicalValidity": {
          "enum": [
            "CONSISTENT_WITH_CURRENT_HIGH_AUTHORITY_EVIDENCE",
            "MATERIALLY_INCONSISTENT",
            "CONTESTABLE"
          ]
        },
        "protocolChangeBasis": {
          "enum": ["GENERALIZED_CLINICAL_DEFECT", "BENCHMARK_SCORE_ONLY"]
        },
        "frozenOfficialResultDisposition": {
          "const": "PRESERVE_UNCHANGED"
        }
      }
    }
  }
}
